ISO 3166-1 Alpha 3-Codes,Region,Country name,Country category,COD-AB URL,COD-AB evaluation,COD-AB live services,COD-PS URL,COD-PS evaluation,AB-PS link,COD-AB reference year,COD-PS reference year,COD-AB remark,COD-PS remark,COD-AB depth,COD-PS depth,COD-AB remark length,COD-PS remark,Name Length,COD-AB-ADM1-EVALUATION,COD-AB-ADM2-EVALUATION,COD-AB-ADM3-EVALUATION,COD-AB-ADM4-EVALUATION,COD-PS-ADM1-EVALUATION,COD-PS-ADM2-EVALUATION,COD-PS-ADM3-EVALUATION,COD-PS-ADM4-EVALUATION,,
TJK,ROCCA,Tajikistan,Preparedness,,4,SUSPENDED,https://data.humdata.org/dataset/tajikistan-population-statistics,1,INAPPLICABLE,,2010,[MISSING EVALUATION],,No fully usable data. ,Fully usable at administrative level 1 only. ,22,2,10,5,5,5,5,1,3,4,4,,
TLS,ROAP,Timor-Leste,Preparedness,https://data.humdata.org/dataset/timor-leste-administrative-boundaries-levels-0-3,1,HDX,https://data.humdata.org/dataset/2015-census-population-for-timor-leste,1,WORKING,,2015,COD-PS linkage to ADM2 only,,Fully usable to administrative level 3. ,Fully usable at administrative level 1 only. ,40,2,11,1,1,1,4,1,3,4,4,,
TON,OP,Tonga,Preparedness,https://data.humdata.org/dataset/tonga-administrative-level-0-1-2-3-boundary-polygons,1,n/a,https://data.humdata.org/dataset/tonga-administrative-level-0-1-2-and-3-population-statistics#,1,WORKING,,2016,,,Fully usable to administrative level 3. ,Fully usable to administrative level 3. ,40,2,5,1,1,1,4,1,1,1,4,,
TTO,ROLAC-Caribbean,Trinidad and Tobago,Preparedness,https://data.humdata.org/dataset/trinidad-and-tobago-administrative-level-0-national-and-1-region-and-municipality-boundaries,1,n/a,https://data.humdata.org/dataset/trinidad-and-tobago-administrative-levels-0-1-population-statistics,1,WORKING,,2011,Sourced from www.gadm.org, only Adm0 and Adm1 available.  No proper P-codes or P-code nesting,,Fully usable at administrative level 1 only. ,Fully usable at administrative level 1 only. ,45,2,19,1,4,4,4,1,4,4,4,
TUN,ROMENA,Tunisia,Preparedness,https://data.humdata.org/dataset/tunisia-administrative-boundaries-populated-places,1,n/a,,4,INAPPLICABLE,,,P-codes not properly formulated,No population statistics COD,Fully usable at administrative level 1 only. ,No dataset.,45,2,7,1,3,4,4,5,5,5,5,,
TUR,SC,Turkey,Operational,https://data.humdata.org/dataset/turkey-administrative-boundaries-levels-0-1-2,1,n/a,,4,INAPPLICABLE,,,,No population statistics COD,Fully usable to administrative level 2. ,No dataset.,40,2,6,1,1,4,4,5,5,5,5,,
TZA,ROSEA,United Republic of Tanzania,Preparedness,https://data.humdata.org/dataset/tanzania-administrative-boundaries-level-1-to-3-regions-districts-and-wards-with-2012-population,1,n/a,https://data.humdata.org/dataset/tanzania-administrative-levels-0-3-population-statistics,3,WORKING,,2011,,Lacking age disaggregated data.,Fully usable to administrative level 3. ,No fully usable data. ,40,2,27,1,1,1,4,3,3,3,4,,
UGA,ROSEA,Uganda,Preparedness,https://data.humdata.org/dataset/uganda-administrative-boundaries-admin-1-admin-3,1,HDX,https://data.humdata.org/dataset/uganda-administrative-level-population-statistics#,1,WORKING,,2020,,,Fully usable to administrative level 4. ,Fully usable to administrative level 2. ,40,2,6,1,1,1,1,1,1,4,4,,
UKR,Europe,Ukraine,Operational,https://data.humdata.org/dataset/ukraine-administrative-boundaries-as-of-q2-2017,1,HDX,https://data.humdata.org/dataset/ukraine-administrative-levels-0-2-population-statistics,3,WORKING,,2018,,Sex and age data not dissaggregated.,Fully usable to administrative level 4. ,No fully usable data. ,40,2,7,1,1,1,1,3,3,4,4,,
URY,ROLAC-Latin-America,Uruguay,Preparedness,https://data.humdata.org/dataset/uruguay-administrative-level-0-boundaries,1,n/a,https://data.humdata.org/dataset/uruguay-subnational-population-statistics,1,WORKING,,2020,"Sourced from www.gadm.org; only Adm0, Adm1, and adm2 available.",,Fully usable to administrative level 2. ,Fully usable at administrative level 1 only. ,40,2,7,1,1,4,4,1,4,4,4,,
UZB,ROCCA,Uzbekistan,Preparedness,https://data.humdata.org/dataset/ubbekistan-update,1,n/a,https://data.humdata.org/dataset/uzbekistan-administrative-level-0-1-population-statistics-and-level-0-2-gazetteer,1,WORKING,,2018,,SADD only available for ADM0 (and therefore the COD-PS does not qualify as fully useful).,Fully usable to administrative level 2. ,No fully usable data. ,40,2,10,1,1,4,4,3,4,4,4,,
VCT,ROLAC-Caribbean,Saint Vincent and The Grenadines,Preparedness,https://data.humdata.org/dataset/saint-vincent-and-the-grenadines-administrative-level-0-country-and-1-parish-boundaries,1,n/a,,4,INAPPLICABLE,,,Sourced from www.gadm.org, only Adm0 and Adm1 available.,No population statistics COD,Fully usable at administrative level 1 only. ,No dataset.,45,2,32,1,4,4,4,5,5,5,5,
VEN,ROLAC-Latin-America,Venezuela (Bolivarian Republic of),Operational,https://data.humdata.org/dataset/venezuela-administrative-level-0-1-and-2-boundaries,3,n/a,https://data.humdata.org/dataset/venezuela-administrative-level-0-1-2-and-3-population-statistics-and-gazeteer,1,WORKING,,2011,USER ALART.  A DUPLICATE COD-AB has been added.  This is being resolved.,,No fully usable data. ,Fully usable to administrative level 2. ,22,2,34,3,3,3,4,1,1,4,4,,
VGB,ROLAC-Caribbean,British Virgin Islands,Preparedness,https://data.humdata.org/dataset/british-virgin-islands-administrative-level-0-nation-and-1-district-boundaries,1,n/a,https://data.humdata.org/dataset/british-virgin-islands-administrative-level-0-1-population-statistics,1,WORKING,,2010,Sourced from www.gadm.org, only Adm0 and Adm1 available.,,Fully usable at administrative level 1 only. ,Fully usable at administrative level 1 only. ,45,2,22,1,4,4,4,1,4,4,4,
VIR,ROLAC-Caribbean,United States Virgin Islands,Preparedness,https://data.humdata.org/dataset/united-states-virgin-islands-administrative-level-0-nation-1-district-and-2-subdistrict-boundaries,1,n/a,https://data.humdata.org/dataset/united-states-virgin-islands-administrative-level-0-2-disaggregated-population-statistics,1,WORKING,,2010,"Sourced from www.gadm.org; only Adm0, Adm1, and adm2 available.",,Fully usable to administrative level 2. ,Fully usable to administrative level 2. ,40,2,28,1,1,4,4,1,1,4,4,,
VNM,ROAP,Viet Nam,Preparedness,https://data.humdata.org/dataset/viet-nam-administrative-boundaries-polygon-polyline,1,HDX,https://data.humdata.org/dataset/viet-nam-administrative-level-0-2-2009-population-statistics,1,WORKING,,2019,,,Fully usable to administrative level 2. ,Fully usable at administrative level 1 only. ,40,2,8,1,1,4,4,1,4,4,4,,
VUT,OP,Vanuatu,Preparedness,https://data.humdata.org/dataset/vanuatu-administrative-level-0-1-and-2-boundaries,1,HDX,https://data.humdata.org/dataset/vanuatu-administrative-level-0-1-and-2-population-statistics,1,WORKING,,2016,,,Fully usable to administrative level 2. ,Fully usable to administrative level 2. ,40,2,7,1,1,4,4,1,1,4,4,,
YEM,ROMENA,Yemen,Operational,https://data.humdata.org/dataset/yemen-admin-boundaries,1,HDX,,4,INAPPLICABLE,,,,No population statistics COD,Fully usable to administrative level 3. ,No dataset.,40,2,5,1,1,1,4,5,5,5,5,,
ZAF,ROSEA,South Africa,Preparedness,https://data.humdata.org/dataset/south-africa-admin-level-1-boundaries,1,HDX,https://data.humdata.org/dataset/south-africa-administrative-levels-0-3-population-statistics,2,WORKING,,2016,Sourced from South African government,Sex disaggregation unavailable,Fully usable to administrative level 4. ,No fully usable data. ,40,2,12,1,1,1,1,2,2,2,4,,
ZMB,ROSEA,Zambia,Preparedness,https://data.humdata.org/dataset/zambia-administrative-boundaries-level-1-provinces-and-level-2-districts-with-census-2010-population,1,HDX,,4,INAPPLICABLE,,,,No population statistics COD,Fully usable to administrative level 2. ,No dataset.,40,2,6,1,1,4,4,5,5,5,5,,
ZWE,ROSEA,Zimbabwe,Preparedness,https://data.humdata.org/dataset/zimbabwe-administrative-levels-0-3-boundaries,1,HDX,https://data.humdata.org/dataset/zimbabwe-administrative-levels-0-2-population-statistics,1,WORKING,,2019,,,Fully usable to administrative level 3. ,Fully usable to administrative level 2. ,40,2,8,1,1,1,4,1,1,4,4,,